{
  "$schema": "https://json-schema.org/draft/2020-12/schema",
  "$id": "https://ferros.local/schemas/hub-local-state-snapshot.schema.json",
  "title": "FERROS Local Hub State Snapshot",
  "description": "Bounded local-only persisted restart snapshot for ferros-hub. This snapshot is non-evidentiary, stays under .tmp/hub/, and does not imply remote transport, Home Assistant integration, or physical-device behavior.",
  "type": "object",
  "required": [
    "bridgeManifestIdentity",
    "policyDecisionLabel",
    "artifactRelativeOutputPath",
    "scope",
    "evidence",
    "lastLocalSummary"
  ],
  "additionalProperties": false,
  "properties": {
    "bridgeManifestIdentity": {
      "type": "string",
      "minLength": 3,
      "pattern": "^[^@]+@[^@]+$"
    },
    "policyDecisionLabel": {
      "type": "string",
      "enum": [
        "allowed",
        "denied:no-grants",
        "denied:profile",
        "denied:capability"
      ]
    },
    "artifactRelativeOutputPath": {
      "type": ["string", "null"],
      "pattern": "^(?!.*://)(?!.*:)(?!.*(?:^|/)\\.\\.(?:/|$))\\.tmp/hub/.+$"
    },
    "scope": {
      "const": "local-only"
    },
    "evidence": {
      "const": "non-evidentiary"
    },
    "lastLocalSummary": {
      "type": "string",
      "minLength": 1,
      "pattern": "^(?!.*://)(?!.*(?:[Hh][Aa][Rr][Dd][Ww][Aa][Rr][Ee]|[Pp][Rr][Oo][Oo][Ff]|[Ll][Aa][Uu][Nn][Cc][Hh]))local-only .+$"
    }
  }
}